BrandName,Product_ID,Product_Name,Category,MRP (Rs.),SellPrice (Rs.),Discount_Percentage %,Product_Desc
amukti,AMUKTI86,AMUKTI86 - Indianwear-Women,Indianwear,1299.0,649.0,50,solid rayon womens kurta - red
amukti,AMUKTI87,AMUKTI87 - Indianwear-Women,Indianwear,1499.0,749.0,50,printed rayon womens kurta - black
amukti,AMUKTI88,AMUKTI88 - Indianwear-Women,Indianwear,1999.0,999.0,50,printed cotton womens kurta - brown
amukti,AMUKTI89,AMUKTI89 - Indianwear-Women,Indianwear,1599.0,799.0,50,ankle length rayon womens kurta - khaki
amukti,AMUKTI90,AMUKTI90 - Indianwear-Women,Indianwear,1499.0,749.0,50,ankle length rayon womens kurta - red
amukti,AMUKTI91,AMUKTI91 - Indianwear-Women,Indianwear,1499.0,749.0,50,embroidered rayon womens kurta - blue
amukti,AMUKTI92,AMUKTI92 - Indianwear-Women,Indianwear,1699.0,849.0,50,embroidered rayon womens kurta - maroon
amukti,AMUKTI93,AMUKTI93 - Indianwear-Women,Indianwear,1999.0,999.0,50,printed cotton womens kurta - red
and,AND1,AND1 - Westernwear-Women,Westernwear,2899.0,2319.0,20,polka dots boat neck viscose womens regular dresses - pink
and,AND2,AND2 - Westernwear-Women,Westernwear,2699.0,2159.0,20,solid polyester square neck womens flared dress - sage
and,AND3,AND3 - Westernwear-Women,Westernwear,2899.0,2319.0,20,solid polyester v neck womens regular dress - wine
and,AND4,AND4 - Westernwear-Women,Westernwear,2499.0,1999.0,20,solid boat neck polyester womens straight dresses - multi
and,AND5,AND5 - Westernwear-Women,Westernwear,2332.222222222222,2099.0,10,floral polyester v neck womens straight top - powder blue
and,AND6,AND6 - Westernwear-Women,Westernwear,1799.0,899.0,50,solid cotton collar neck womens top - rose
and,AND7,AND7 - Westernwear-Women,Westernwear,2699.0,2159.0,20,solid round neck polyester womens straight top - black
and,AND8,AND8 - Westernwear-Women,Westernwear,3499.0,2799.0,20,floral square neck polyester womens flared gown - sage
and,AND9,AND9 - Westernwear-Women,Westernwear,1899.0,1519.0,20,solid polyester v neck womens regular top - wine
and,AND10,AND10 - Westernwear-Women,Westernwear,3899.0,3119.0,20,floral linen round neck womens straight dress - pink mix
and,AND11,AND11 - Westernwear-Women,Westernwear,2299.0,1149.0,50,solid polyester v neck womens regular dress - peach
and,AND12,AND12 - Westernwear-Women,Westernwear,1699.0,1359.0,20,solid round neck polyester womens straight top - yellow
and,AND13,AND13 - Westernwear-Women,Westernwear,3299.0,2639.0,20,solid collar neck linen womens straight dresses - wine
and,AND14,AND14 - Westernwear-Women,Westernwear,2099.0,1679.0,20,floral polyester round neck womens straight top - sage
and,AND15,AND15 - Westernwear-Women,Westernwear,1999.0,1599.0,20,floral polyester v neck womens flared top - black
and,AND16,AND16 - Westernwear-Women,Westernwear,4299.0,3439.0,20,solid round neck polyester womens flared gown - pink mix
and,AND17,AND17 - Westernwear-Women,Westernwear,1899.0,1519.0,20,solid cotton collar neck womens straight top - white
and,AND18,AND18 - Westernwear-Women,Westernwear,2699.0,1754.0,35,solid polyester crew neck womens top - teal
and,AND19,AND19 - Westernwear-Women,Westernwear,4899.0,3919.0,20,solid polyester square neck womens flared gown - powder blue
and,AND20,AND20 - Westernwear-Women,Westernwear,1899.0,759.0,60,embroidered polyester square neck womens top - magenta
and,AND21,AND21 - Westernwear-Women,Westernwear,3899.0,3119.0,20,solid 3/4 sleeves polyester womens regular jumpsuit - light blue
and,AND22,AND22 - Westernwear-Women,Westernwear,2499.0,1999.0,20,solid v neck polyester womens flared dresses - pink
and,AND23,AND23 - Westernwear-Women,Westernwear,2899.0,2319.0,20,floral round neck polyester womens regular dress - white
and,AND24,AND24 - Westernwear-Women,Westernwear,2699.0,2429.0,10,foil viscose square neck womens flared dress - gold
and,AND25,AND25 - Westernwear-Women,Westernwear,4332.222222222222,3899.0,10,printed collar neck linen womens straight jumpsuits - pink
and,AND26,AND26 - Westernwear-Women,Westernwear,2899.0,2319.0,20,floral polyester square neck womens regular dress - white
and,AND27,AND27 - Westernwear-Women,Westernwear,5299.0,4239.0,20,solid half sleeves linen womens regular length jumpsuit - pink mix
and,AND28,AND28 - Westernwear-Women,Westernwear,1899.0,1519.0,20,solid cotton round neck womens straight top - black
and,AND29,AND29 - Westernwear-Women,Westernwear,2099.0,1679.0,20,floral polyester round neck womens straight top - multi
and,AND30,AND30 - Westernwear-Women,Westernwear,2099.0,1679.0,20,solid polyester v neck womens straight top - gold
and,AND31,AND31 - Westernwear-Women,Westernwear,2899.0,2609.0,10,solid cotton round neck womens dress - maroon
and,AND32,AND32 - Westernwear-Women,Westernwear,3699.0,2959.0,20,geometric v neck linen womens straight jumpsuits - white
and,AND33,AND33 - Westernwear-Women,Westernwear,1599.0,1279.0,20,printed round neck polyester womens straight top - multi
and,AND34,AND34 - Westernwear-Women,Westernwear,3699.0,2959.0,20,solid polyester v neck womens flared gown - navy
and,AND35,AND35 - Westernwear-Women,Westernwear,2099.0,1679.0,20,floral round neck polyester womens regular top - white
and,AND36,AND36 - Westernwear-Women,Westernwear,3899.0,3119.0,20,floral square neck polyester womens regular dresses - white
and,AND37,AND37 - Westernwear-Women,Westernwear,2899.0,1884.0,35,solid viscose collar neck womens regular dress - black
and,AND38,AND38 - Westernwear-Women,Westernwear,1899.0,1519.0,20,solid polyester collar neck womens straight top - pink
and,AND39,AND39 - Westernwear-Women,Westernwear,3899.0,3119.0,20,self design  viscose womens gown - pink
and,AND40,AND40 - Westernwear-Women,Westernwear,3099.0,2479.0,20,solid round neck polyester womens flared dresses - navy
and,AND41,AND41 - Westernwear-Women,Westernwear,2099.0,1679.0,20,solid round neck polyester womens straight top - pink
and,AND42,AND42 - Westernwear-Women,Westernwear,1699.0,1359.0,20,solid polyester round neck womens straight top - red
and,AND43,AND43 - Westernwear-Women,Westernwear,2099.0,1679.0,20,solid linen v neck womens regular top - blue
and,AND44,AND44 - Westernwear-Women,Westernwear,3899.0,3119.0,20,printed polyester v neck womens regular dress - gold
and,AND45,AND45 - Westernwear-Women,Westernwear,3099.0,2479.0,20,floral linen square neck womens straight dress - multi
and,AND46,AND46 - Westernwear-Women,Westernwear,2199.0,1979.0,10,solid polyester regular fit womens pants - black
and,AND47,AND47 - Westernwear-Women,Westernwear,1899.0,1234.0,35,solid polyester collar neck womens top - brown
and,AND48,AND48 - Westernwear-Women,Westernwear,2776.6666666666665,2499.0,10,regular fit polyester womens formal pants - natural
and,AND49,AND49 - Westernwear-Women,Westernwear,1999.0,999.0,50,jacquard polyester round neck womens work wear jacket - black mix
and,AND50,AND50 - Westernwear-Women,Westernwear,2299.0,1839.0,20,floral linen square neck womens straight top - pink
and,AND51,AND51 - Westernwear-Women,Westernwear,2899.0,1449.0,50,printed viscose round neck womens top - blue mix light
and,AND52,AND52 - Westernwear-Women,Westernwear,3099.0,2479.0,20,solid polyester round neck womens flared dress - powder blue
and,AND53,AND53 - Westernwear-Women,Westernwear,1899.0,1519.0,20,solid polyester round neck womens straight top - sage
and,AND54,AND54 - Westernwear-Women,Westernwear,1899.0,1234.0,35,solid polyester round neck womens straight top - cream
and,AND55,AND55 - Westernwear-Women,Westernwear,3499.0,2799.0,20,floral linen v neck womens flared dress - pink
and,AND56,AND56 - Westernwear-Women,Westernwear,1799.0,1619.0,10,foil polyester square neck womens top - aqua
and,AND57,AND57 - Westernwear-Women,Westernwear,3443.333333333333,3099.0,10,solid polyester square neck womens flared gown - red
and,AND58,AND58 - Westernwear-Women,Westernwear,3887.777777777778,3499.0,10,floral round neck polyester womens straight jumpsuits - multi
and,AND59,AND59 - Westernwear-Women,Westernwear,2899.0,2319.0,20,solid polyester v neck womens regular gown - red
and,AND60,AND60 - Westernwear-Women,Westernwear,2499.0,1249.0,50,floral polyester v neck womens regular dress - teal
and,AND61,AND61 - Westernwear-Women,Westernwear,3443.333333333333,3099.0,10,floral round neck polyester womens midi dress - powder blue
and,AND62,AND62 - Westernwear-Women,Westernwear,2499.0,1999.0,20,solid cotton round neck womens regular dress - black
and,AND63,AND63 - Westernwear-Women,Westernwear,3099.0,1549.0,50,solid acrylic boat neck womens straight top - pink
and,AND64,AND64 - Westernwear-Women,Westernwear,2099.0,1679.0,20,solid polyester collar neck womens straight top - blue
and,AND65,AND65 - Westernwear-Women,Westernwear,3099.0,2479.0,20,floral polyester square neck womens straight dress - sage
and,AND66,AND66 - Westernwear-Women,Westernwear,3099.0,2479.0,20,floral polyester v neck womens flared dress - yellow
and,AND67,AND67 - Westernwear-Women,Westernwear,2499.0,1999.0,20,solid v-neck polyester womens regular dress - rose
and,AND68,AND68 - Westernwear-Women,Westernwear,1399.0,1119.0,20,floral linen square neck womens straight top - pink mix
and,AND69,AND69 - Westernwear-Women,Westernwear,3099.0,1549.0,50,solid polyester round neck womens regular dress - red
and,AND70,AND70 - Westernwear-Women,Westernwear,4899.0,2449.0,50,solid full sleeves acrylic womens regular jacket - black
and,AND71,AND71 - Westernwear-Women,Westernwear,2099.0,1679.0,20,floral linen square neck womens straight top - pink mix
and,AND72,AND72 - Westernwear-Women,Westernwear,2899.0,2609.0,10,solid cotton round neck womens regular dress - green
and,AND73,AND73 - Westernwear-Women,Westernwear,3099.0,2479.0,20,floral polyester v neck womens straight dress - powder blue
and,AND74,AND74 - Westernwear-Women,Westernwear,1799.0,899.0,50,solid polyester collar neck womens top - natural
and,AND75,AND75 - Westernwear-Women,Westernwear,2499.0,1999.0,20,floral polyester round neck womens regular top - multi
and,AND76,AND76 - Westernwear-Women,Westernwear,2699.0,2159.0,20,floral polyester square neck womens straight dress - cream
and,AND77,AND77 - Westernwear-Women,Westernwear,3221.111111111111,2899.0,10,solid square neck polyester womens midi dress - red
and,AND78,AND78 - Westernwear-Women,Westernwear,1899.0,1519.0,20,solid viscose round neck womens regular top - yellow
and,AND79,AND79 - Westernwear-Women,Westernwear,1999.0,799.0,60,womens regular fit striped top - light blue
and,AND80,AND80 - Westernwear-Women,Westernwear,2099.0,1679.0,20,solid viscose round neck womens straight top - lilac
and,AND81,AND81 - Westernwear-Women,Westernwear,2776.6666666666665,2499.0,10,solid cotton round neck womens dress - black
and,AND82,AND82 - Westernwear-Women,Westernwear,2499.0,1999.0,20,solid polyester round neck womens flared dress - yellow
and,AND83,AND83 - Westernwear-Women,Westernwear,1699.0,1359.0,20,polka dots viscose round neck womens flared top - pink
and,AND84,AND84 - Westernwear-Women,Westernwear,1999.0,999.0,50,striped round neck womens woven top - blue
and,AND85,AND85 - Westernwear-Women,Westernwear,3499.0,2799.0,20,floral v-neck polyester womens flared dress - multi
and,AND86,AND86 - Westernwear-Women,Westernwear,1699.0,679.0,60,womens regular fit checked top - blue
and,AND87,AND87 - Westernwear-Women,Westernwear,2099.0,1679.0,20,solid linen collar neck womens straight top - orange
and,AND88,AND88 - Westernwear-Women,Westernwear,2099.0,1679.0,20,floral polyester round neck womens straight top - yellow
and,AND89,AND89 - Westernwear-Women,Westernwear,3499.0,2799.0,20,solid linen round neck womens straight dress - red
and,AND90,AND90 - Westernwear-Women,Westernwear,3110.0,2799.0,10,flared fit cotton womens casual pants - white
and,AND91,AND91 - Westernwear-Women,Westernwear,2499.0,1249.0,50,solid polyester v neck womens straight top - pink mix
and,AND92,AND92 - Westernwear-Women,Westernwear,2299.0,1839.0,20,solid viscose collar neck womens straight top - yellow
and,AND93,AND93 - Westernwear-Women,Westernwear,1999.0,999.0,50,solid viscose round neck womens straight top - emerald
and,AND94,AND94 - Westernwear-Women,Westernwear,4299.0,2149.0,50,solid full sleeves polyester womens regular jacket - black
and,AND95,AND95 - Westernwear-Women,Westernwear,2699.0,2159.0,20,floral polyester boat neck womens flared dress - white
and,AND96,AND96 - Westernwear-Women,Westernwear,4099.0,3279.0,20,floral polyester square neck womens flared gown - multi
and,AND97,AND97 - Westernwear-Women,Westernwear,2999.0,1949.0,35,floral viscose square neck womens flared dress - purple
and,AND98,AND98 - Westernwear-Women,Westernwear,2799.0,1399.0,50,solid v-neck viscose womens workwear dress - blue mix light
and,AND99,AND99 - Westernwear-Women,Westernwear,1699.0,849.0,50,solid linen v- neck women wrap top - blue mix light
and,AND100,AND100 - Westernwear-Women,Westernwear,4099.0,3279.0,20,solid polyester collar neck womens regular gown - teal
and,AND101,AND101 - Westernwear-Women,Westernwear,2899.0,1449.0,50,solid polyester collar neck womens straight dress - multi
and,AND102,AND102 - Westernwear-Women,Westernwear,1699.0,1359.0,20,solid polyester boat neck womens regular top - red
and,AND103,AND103 - Westernwear-Women,Westernwear,3499.0,2799.0,20,floral polyester v neck womens regular dress - navy
and,AND104,AND104 - Westernwear-Women,Westernwear,2699.0,1349.0,50,solid full sleeves polyester womens knee length jacket - olive
and,AND105,AND105 - Westernwear-Women,Westernwear,2199.0,1099.0,50,solid viscose v neck womens straight top - blue mix light
and,AND106,AND106 - Westernwear-Women,Westernwear,1499.0,599.0,60,womens solid v-neck top - pink mix
and,AND107,AND107 - Westernwear-Women,Westernwear,3499.0,2799.0,20,dyed square neck polyester womens flared dresses - lilac
and,AND108,AND108 - Westernwear-Women,Westernwear,1699.0,1189.0,30,solid polyester round neck womens top - black
and,AND109,AND109 - Westernwear-Women,Westernwear,999.0,499.0,50,womens shirt type fit v neck floral printed ruffled top - light blue
and,AND110,AND110 - Westernwear-Women,Westernwear,1899.0,1519.0,20,floral polyester round neck womens straight top - white
and,AND111,AND111 - Westernwear-Women,Westernwear,2699.0,2159.0,20,floral polyester collar neck womens straight dress - emerald
and,AND112,AND112 - Westernwear-Women,Westernwear,2899.0,1449.0,50,printed cotton v neck womens casual jacket - mid blue
and,AND113,AND113 - Westernwear-Women,Westernwear,4299.0,3439.0,20,solid polyester v neck womens flared dress - sage
and,AND114,AND114 - Westernwear-Women,Westernwear,3099.0,2479.0,20,solid polyester v neck womens flared dress - peach
and,AND115,AND115 - Westernwear-Women,Westernwear,3699.0,2959.0,20,floral 3/4 sleeves linen womens calf length jumpsuit - powder blue
and,AND116,AND116 - Westernwear-Women,Westernwear,2699.0,2159.0,20,solid polyester collar neck womens straight dress - peach
and,AND117,AND117 - Westernwear-Women,Westernwear,3099.0,2479.0,20,floral polyester round neck womens flared dress - white
and,AND118,AND118 - Westernwear-Women,Westernwear,1899.0,1709.0,10,graphic viscose y neck womens top - olive
and,AND119,AND119 - Westernwear-Women,Westernwear,2499.0,1249.0,50,printed cotton collar neck womens top - light blue
and,AND120,AND120 - Westernwear-Women,Westernwear,1899.0,1519.0,20,solid round neck polyester womens straight top - red
and,AND121,AND121 - Westernwear-Women,Westernwear,1699.0,1359.0,20,solid polyester v neck womens regular top - wine
and,AND122,AND122 - Westernwear-Women,Westernwear,2699.0,1349.0,50,solid viscose round neck womens straight top - orange
and,AND123,AND123 - Westernwear-Women,Westernwear,3499.0,1399.0,60,womens stripes casual wear jumpsuit - natural
and,AND124,AND124 - Westernwear-Women,Westernwear,2699.0,2159.0,20,solid square neck linen womens flared dress - orange
and,AND125,AND125 - Westernwear-Women,Westernwear,2099.0,1679.0,20,floral linen square neck womens flared top - pink
and,AND126,AND126 - Westernwear-Women,Westernwear,2332.222222222222,2099.0,10,solid regular fit rayon womens work wear trousers - navy
and,AND127,AND127 - Westernwear-Women,Westernwear,2799.0,1119.0,60,women v-neck floral fit and flare gown - lemon
and,AND128,AND128 - Westernwear-Women,Westernwear,2899.0,2319.0,20,floral polyester square neck womens straight dress - yellow
and,AND129,AND129 - Westernwear-Women,Westernwear,2299.0,1839.0,20,solid polyester v neck womens straight top - pink
and,AND130,AND130 - Westernwear-Women,Westernwear,3699.0,2959.0,20,floral round neck polyester womens straight gown - multi
and,AND131,AND131 - Westernwear-Women,Westernwear,2099.0,1679.0,20,solid polyester round neck womens top - white
and,AND132,AND132 - Westernwear-Women,Westernwear,1899.0,1329.0,30,solid tencel collar neck womens top - pink
and,AND133,AND133 - Westernwear-Women,Westernwear,2299.0,1839.0,20,solid viscose collar neck womens straight top - white
and,AND134,AND134 - Westernwear-Women,Westernwear,2776.6666666666665,2499.0,10,solid straight fit polyester womens trousers - black
and,AND135,AND135 - Westernwear-Women,Westernwear,6110.0,5499.0,10,floral square neck polyester womens gown - white
and,AND136,AND136 - Westernwear-Women,Westernwear,5499.0,2749.0,50,printed nylon v neck womens casual jacket - cream
and,AND137,AND137 - Westernwear-Women,Westernwear,2699.0,2429.0,10,solid cotton round neck womens regular dress - lilac
and,AND138,AND138 - Westernwear-Women,Westernwear,2099.0,1679.0,20,floral polyester v neck womens regular top - blue
and,AND139,AND139 - Westernwear-Women,Westernwear,1899.0,1519.0,20,solid polyester round neck womens regular top - blush
and,AND140,AND140 - Westernwear-Women,Westernwear,1699.0,1359.0,20,floral cotton square neck womens straight top - lemon
and,AND141,AND141 - Westernwear-Women,Westernwear,3665.5555555555557,3299.0,10,solid collar neck linen womens maxi dress - black
and,AND142,AND142 - Westernwear-Women,Westernwear,1699.0,849.0,50,checks viscose shirt collar womens a-line top - navy
and,AND143,AND143 - Westernwear-Women,Westernwear,5443.333333333333,4899.0,10,solid collar neck linen womens straight jumpsuits - lemon
and,AND144,AND144 - Westernwear-Women,Westernwear,2299.0,2069.0,10,solid polyester square neck womens dress - black
and,AND145,AND145 - Westernwear-Women,Westernwear,1299.0,1039.0,20,floral polyester square neck womens straight top - white
and,AND146,AND146 - Westernwear-Women,Westernwear,3699.0,2959.0,20,floral three quarter sleeves linen womens full length jumpsuit - powder blue
and,AND147,AND147 - Westernwear-Women,Westernwear,2699.0,1889.0,30,printed polyester v neck womens regular dress - black
and,AND148,AND148 - Westernwear-Women,Westernwear,2499.0,999.0,60,womens regular fit solid jumpsuit - light olive
and,AND149,AND149 - Westernwear-Women,Westernwear,1899.0,1519.0,20,polka dots viscose collar neck womens regular top - yellow
and,AND150,AND150 - Westernwear-Women,Westernwear,2299.0,1839.0,20,solid polyester v neck womens straight dress - pink
and,AND151,AND151 - Westernwear-Women,Westernwear,2099.0,1469.0,30,floral polyester round neck womens top - white
and,AND152,AND152 - Westernwear-Women,Westernwear,2899.0,1449.0,50,floral square neck viscose womens flared dress - sage
and,AND153,AND153 - Westernwear-Women,Westernwear,3499.0,2799.0,20,solid cotton round neck womens regular gown - black
and,AND154,AND154 - Westernwear-Women,Westernwear,5299.0,3444.0,35,solid polyester round neck womens regular gown - emerald
and,AND155,AND155 - Westernwear-Women,Westernwear,1799.0,899.0,50,stripes linen round neck womens a-line top - pink
and,AND156,AND156 - Westernwear-Women,Westernwear,1399.0,1119.0,20,solid round neck polyester womens straight top - lemon
and,AND157,AND157 - Westernwear-Women,Westernwear,3099.0,2479.0,20,solid half sleeves polyester womens full length jumpsuit - navy
and,AND158,AND158 - Westernwear-Women,Westernwear,2099.0,1679.0,20,geometric linen collar neck womens straight top - white
and,AND159,AND159 - Westernwear-Women,Westernwear,3899.0,3509.0,10,solid cotton round neck womens dress - navy
and,AND160,AND160 - Westernwear-Women,Westernwear,1899.0,1519.0,20,solid viscose v neck womens straight top - sage
and,AND161,AND161 - Westernwear-Women,Westernwear,3799.0,1899.0,50,checks round neck polyester womens jacket - grey
and,AND162,AND162 - Westernwear-Women,Westernwear,3299.0,1649.0,50,solid cotton round neck womens regular dress - rosewood
and,AND163,AND163 - Westernwear-Women,Westernwear,3099.0,2789.0,10,solid cotton round neck womens dress - green
and,AND164,AND164 - Westernwear-Women,Westernwear,2499.0,1999.0,20,solid round neck polyester womens regular dresses - red
and,AND165,AND165 - Westernwear-Women,Westernwear,1299.0,649.0,50,solid polyester round neck women straight tops - blue mix light
and,AND166,AND166 - Westernwear-Women,Westernwear,3999.0,3199.0,20,solid polyester v neck womens flared gown - teal
and,AND167,AND167 - Westernwear-Women,Westernwear,2499.0,999.0,60,womens fit and flare mandarin collar floral printed skater dress - blue
and,AND168,AND168 - Westernwear-Women,Westernwear,1999.0,799.0,60,womens linen skirts - natural
and,AND169,AND169 - Westernwear-Women,Westernwear,2499.0,1999.0,20,floral comfort linen womens fusion wear trousers - multi
and,AND170,AND170 - Westernwear-Women,Westernwear,2299.0,2069.0,10,solid cotton round neck womens regular dress - pink
and,AND171,AND171 - Westernwear-Women,Westernwear,3099.0,2479.0,20,solid v neck polyester womens flared gown - peach
and,AND172,AND172 - Westernwear-Women,Westernwear,2699.0,2159.0,20,solid v neck polyester womens midi dress - lilac
and,AND173,AND173 - Westernwear-Women,Westernwear,2899.0,1449.0,50,solid polyester round neck womens straight top - wine
and,AND174,AND174 - Westernwear-Women,Westernwear,3099.0,2479.0,20,solid round neck polyester women flared dress - emerald
and,AND175,AND175 - Westernwear-Women,Westernwear,2299.0,1839.0,20,floral polyester round neck womens straight top - mint
and,AND176,AND176 - Westernwear-Women,Westernwear,1799.0,899.0,50,womens shirt type fit round neck self printed top - orange
and,AND177,AND177 - Westernwear-Women,Westernwear,1299.0,649.0,50,self pattern polyester v neck womens regular fit top - aqua
and,AND178,AND178 - Westernwear-Women,Westernwear,1199.0,839.0,30,solid polyester square neck women a line tops - wine
and,AND179,AND179 - Westernwear-Women,Westernwear,1999.0,999.0,50,floral cotton square neck womens a-line top - light blue
and,AND180,AND180 - Westernwear-Women,Westernwear,1999.0,1599.0,20,solid polyester round neck womens top - peach
and,AND181,AND181 - Westernwear-Women,Westernwear,1899.0,1519.0,20,solid polyester collar neck womens top - natural
and,AND182,AND182 - Westernwear-Women,Westernwear,2299.0,1839.0,20,floral v neck cotton womens flared dresses - ecru
and,AND183,AND183 - Westernwear-Women,Westernwear,1699.0,1359.0,20,printed polyester v-neck womens peplum top - lilac
and,AND184,AND184 - Westernwear-Women,Westernwear,3499.0,1749.0,50,solid acrylic round neck womens straight dress - blue mix light
and,AND185,AND185 - Westernwear-Women,Westernwear,2499.0,999.0,60,womens regular fit solid skirt - brown
and,AND186,AND186 - Westernwear-Women,Westernwear,3499.0,2799.0,20,floral square neck linen womens straight dress - blue
and,AND187,AND187 - Westernwear-Women,Westernwear,2998.8888888888887,2699.0,10,solid polyester tie up neck womens regular dress - peach
and,AND188,AND188 - Westernwear-Women,Westernwear,3299.0,2639.0,20,solid rayon collar neck womens straight dress - pink
and,AND189,AND189 - Westernwear-Women,Westernwear,2332.222222222222,2099.0,10,solid regular fit rayon womens work wear trousers - black
and,AND190,AND190 - Westernwear-Women,Westernwear,2699.0,1349.0,50,solid acrylic v neck womens straight top - yellow
and,AND191,AND191 - Westernwear-Women,Westernwear,1999.0,999.0,50,solid v-neck polyester womens evening dress - black
and,AND192,AND192 - Westernwear-Women,Westernwear,2699.0,1349.0,50,printed viscose high neck womens top - white
and,AND193,AND193 - Westernwear-Women,Westernwear,3099.0,1549.0,50,solid polyester square neck womens straight dress - teal
and,AND194,AND194 - Westernwear-Women,Westernwear,1899.0,1519.0,20,solid polyester collar neck womens straight top - wine
and,AND195,AND195 - Westernwear-Women,Westernwear,2332.222222222222,2099.0,10,tapered three quarter length linen womens fusion wear shorts - wine
and,AND196,AND196 - Westernwear-Women,Westernwear,2099.0,1049.0,50,floral polyester v-neck womens fit and flare top - blue mix light
and,AND197,AND197 - Westernwear-Women,Westernwear,2199.0,1099.0,50,printed viscose v neck womens top - pink mix
and,AND198,AND198 - Westernwear-Women,Westernwear,1399.0,1119.0,20,solid collar neck viscose womens straight top - blue
and,AND199,AND199 - Westernwear-Women,Westernwear,2499.0,1249.0,50,floral polyester square neck womens straight dress - multi
and,AND200,AND200 - Westernwear-Women,Westernwear,3887.777777777778,3499.0,10,solid square neck cotton womens midi dress - pink
and,AND201,AND201 - Westernwear-Women,Westernwear,2332.222222222222,2099.0,10,solid tapered polyester womens work wear trousers - blue
and,AND202,AND202 - Westernwear-Women,Westernwear,2499.0,1249.0,50,solid viscose round neck womens straight top - wine
and,AND203,AND203 - Westernwear-Women,Westernwear,3299.0,2639.0,20,solid polyester v neck womens flared dress - pink
and,AND204,AND204 - Westernwear-Women,Westernwear,4199.0,2099.0,50,floral full sleeves polyester womens regular jacket - black
and,AND205,AND205 - Westernwear-Women,Westernwear,1499.0,749.0,50,solid v-neck womens tie-ups top - sage
and,AND206,AND206 - Westernwear-Women,Westernwear,2799.0,1399.0,50,floral square neck viscose womens regular fit gown - blue mix light
and,AND207,AND207 - Westernwear-Women,Westernwear,3887.777777777778,3499.0,10,solid 3/4 sleeves polyester womens regular length jumpsuit - peach
