BrandName,Product_ID,Product_Name,Category,MRP (Rs.),SellPrice (Rs.),Discount_Percentage %,Product_Desc
aurelia,AURELIA229,AURELIA229 - Indianwear-Women,Indianwear,1665.5555555555554,1499.0,10,printed viscose round neck womens knee length kurta - blue
aurelia,AURELIA230,AURELIA230 - Indianwear-Women,Indianwear,1499.0,1049.0,30,mandarin straight designer womens kurtas - yellow
aurelia,AURELIA231,AURELIA231 - Indianwear-Women,Indianwear,2499.0,1249.0,50,yarn dyed round neck dobby womens a-line dress - yellow
aurelia,AURELIA232,AURELIA232 - Indianwear-Women,Indianwear,1999.0,1399.0,30,cotton round neck womens kurta set - orange
aurelia,AURELIA233,AURELIA233 - Indianwear-Women,Indianwear,1665.5555555555554,1499.0,10,yarn dyed shirt collar with placket twill stripe womens a-line dress - peach
aurelia,AURELIA234,AURELIA234 - Indianwear-Women,Indianwear,799.0,479.0,40,solid regular fit cotton lycra womens casual pants - red
aurelia,AURELIA235,AURELIA235 - Indianwear-Women,Indianwear,1699.0,1189.0,30,printed cotton womens casual culottes - yellow
aurelia,AURELIA236,AURELIA236 - Indianwear-Women,Indianwear,554.4444444444445,499.0,10,dyed regular length cotton woven womens dupatta - gold
aurelia,AURELIA237,AURELIA237 - Indianwear-Women,Indianwear,1110.0,999.0,10,printed poly blend womens festive dupatta - white
aurelia,AURELIA238,AURELIA238 - Indianwear-Women,Indianwear,1199.0,839.0,30,printed band with v polyester womens knee length kurta - multi
aurelia,AURELIA239,AURELIA239 - Indianwear-Women,Indianwear,1221.111111111111,1099.0,10,printed round neck viscose womens calf length kurta - white
aurelia,AURELIA240,AURELIA240 - Indianwear-Women,Indianwear,1110.0,999.0,10,solid round neck cotton blend womens knee length kurta - white
aurelia,AURELIA241,AURELIA241 - Indianwear-Women,Indianwear,2699.0,1889.0,30,printed viscose round neck womens ethnic set - pink
aurelia,AURELIA242,AURELIA242 - Indianwear-Women,Indianwear,4665.555555555556,4199.0,10,printed viscose regular fit womens kurta set - white
aurelia,AURELIA243,AURELIA243 - Indianwear-Women,Indianwear,1499.0,899.0,40,printed viscose regular fit womens culottes - pink
aurelia,AURELIA244,AURELIA244 - Indianwear-Women,Indianwear,4443.333333333333,3999.0,10,printed viscose womens ethnic set - pink
aurelia,AURELIA245,AURELIA245 - Indianwear-Women,Indianwear,999.0,699.0,30,dyed poly viscose regular fit womens festive trousers - white
aurelia,AURELIA246,AURELIA246 - Indianwear-Women,Indianwear,3998.8888888888887,3599.0,10,printed polyester mandarin womens ethnic set - blue
aurelia,AURELIA247,AURELIA247 - Indianwear-Women,Indianwear,1399.0,979.0,30,yarn dyed cotton round neck womens straight kurta - red
aurelia,AURELIA248,AURELIA248 - Indianwear-Women,Indianwear,776.6666666666666,699.0,10,printed polyester spandex womens casual tights - gold
aurelia,AURELIA249,AURELIA249 - Indianwear-Women,Indianwear,1399.0,979.0,30,mandarin straight designer womens kurtas - pink
aurelia,AURELIA250,AURELIA250 - Indianwear-Women,Indianwear,3332.222222222222,2999.0,10,printed viscose womens ethnic set - green
aurelia,AURELIA251,AURELIA251 - Indianwear-Women,Indianwear,1049.0,629.0,40,dyed cotton mandarin neck womens above knee kurta - pink
aurelia,AURELIA252,AURELIA252 - Indianwear-Women,Indianwear,1499.0,749.0,50,yarn dyed shirt collar straight womens kurta - green
aurelia,AURELIA253,AURELIA253 - Indianwear-Women,Indianwear,2799.0,1959.0,30,round neck viscose flared designer womens dresses - red
aurelia,AURELIA254,AURELIA254 - Indianwear-Women,Indianwear,1665.5555555555554,1499.0,10,dyed cotton blend mandarin womens straight kurta - blue
aurelia,AURELIA255,AURELIA255 - Indianwear-Women,Indianwear,665.5555555555555,599.0,10,solid cotton blend womens casual tights - white
aurelia,AURELIA256,AURELIA256 - Indianwear-Women,Indianwear,1499.0,749.0,50,printed viscose round neck womens knee length kurta - pink
aurelia,AURELIA257,AURELIA257 - Indianwear-Women,Indianwear,4443.333333333333,3999.0,10,printed polyester round neck womens ethnic set - red
aurelia,AURELIA258,AURELIA258 - Indianwear-Women,Indianwear,699.0,489.0,30,solid cotton lycra regular fit womens tights - green
aurelia,AURELIA259,AURELIA259 - Indianwear-Women,Indianwear,1443.3333333333333,1299.0,10,solid viscose round neck womens above knee kurta - maroon
aurelia,AURELIA260,AURELIA260 - Indianwear-Women,Indianwear,1699.0,1189.0,30,printed band with placket cotton blend womens calf length kurta - blue
aurelia,AURELIA261,AURELIA261 - Indianwear-Women,Indianwear,1554.4444444444443,1399.0,10,dyed cotton round neck womens straight kurta - peach
aurelia,AURELIA262,AURELIA262 - Indianwear-Women,Indianwear,1665.5555555555554,1499.0,10,dyed viscose round neck womens straight kurta - natural
aurelia,AURELIA263,AURELIA263 - Indianwear-Women,Indianwear,4998.888888888889,4499.0,10,printed georgette round neck womens flared dress - pink
aurelia,AURELIA264,AURELIA264 - Indianwear-Women,Indianwear,5554.444444444444,4999.0,10,printed polyester round neck womens ethnic set - blue
aurelia,AURELIA265,AURELIA265 - Indianwear-Women,Indianwear,1110.0,999.0,10,dyed poly viscose regular fit womens festive trousers - multi
aurelia,AURELIA266,AURELIA266 - Indianwear-Women,Indianwear,1499.0,1049.0,30,printed viscose mandarin womens straight kurta - red
aurelia,AURELIA267,AURELIA267 - Indianwear-Women,Indianwear,1199.0,599.0,50,printed viscose mandarin neck womens above knee kurta - green
aurelia,AURELIA268,AURELIA268 - Indianwear-Women,Indianwear,1887.7777777777778,1699.0,10,printed crepe round neck womens flared dress - natural
aurelia,AURELIA269,AURELIA269 - Indianwear-Women,Indianwear,999.0,699.0,30,printed polyester womens straight kurta - blue
aurelia,AURELIA270,AURELIA270 - Indianwear-Women,Indianwear,2554.4444444444443,2299.0,10,dyed cotton womens a line dress - pink
aurelia,AURELIA271,AURELIA271 - Indianwear-Women,Indianwear,3332.222222222222,2999.0,10,printed polyester round neck womens ankle length kurta - blue
aurelia,AURELIA272,AURELIA272 - Indianwear-Women,Indianwear,1399.0,979.0,30,printed viscose womens straight kurta - green
aurelia,AURELIA273,AURELIA273 - Indianwear-Women,Indianwear,999.0,699.0,30,v- neck straight designer womens kurtas - yellow
aurelia,AURELIA274,AURELIA274 - Indianwear-Women,Indianwear,1399.0,979.0,30,printed viscose round neck womens straight kurta - blue
aurelia,AURELIA275,AURELIA275 - Indianwear-Women,Indianwear,1699.0,1189.0,30,dyed cotton womens straight kurta - green
aurelia,AURELIA276,AURELIA276 - Indianwear-Women,Indianwear,1399.0,699.0,50,printed round neck straight womens kurta - pink
aurelia,AURELIA277,AURELIA277 - Indianwear-Women,Indianwear,665.5555555555555,599.0,10,solid cotton blend womens casual tights - blue
aurelia,AURELIA278,AURELIA278 - Indianwear-Women,Indianwear,4599.0,2299.0,50,printed viscose blend round neck womens ethnic set - black
aurelia,AURELIA279,AURELIA279 - Indianwear-Women,Indianwear,1110.0,999.0,10,printed polyester regular fit womens dupatta - blue
aurelia,AURELIA280,AURELIA280 - Indianwear-Women,Indianwear,887.7777777777777,799.0,10,dyed cotton womens casual dupatta - red
aurelia,AURELIA281,AURELIA281 - Indianwear-Women,Indianwear,1399.0,979.0,30,v- neck straight designer womens kurtas - natural
aurelia,AURELIA282,AURELIA282 - Indianwear-Women,Indianwear,3998.8888888888887,3599.0,10,printed viscose round neck womens ethnic set - black
aurelia,AURELIA283,AURELIA283 - Indianwear-Women,Indianwear,2599.0,1819.0,30,dyed cotton womens ethnic set - blue
aurelia,AURELIA284,AURELIA284 - Indianwear-Women,Indianwear,2499.0,1249.0,50,round neck cotton dobby womens kurta set - blue
aurelia,AURELIA285,AURELIA285 - Indianwear-Women,Indianwear,1665.5555555555554,1499.0,10,printed rayon round neck womens straight kurta - blue
aurelia,AURELIA286,AURELIA286 - Indianwear-Women,Indianwear,887.7777777777777,799.0,10,dyed cotton womens casual dupatta - green
aurelia,AURELIA287,AURELIA287 - Indianwear-Women,Indianwear,4221.111111111111,3799.0,10,printed viscose round neck womens ethnic set - green
aurelia,AURELIA288,AURELIA288 - Indianwear-Women,Indianwear,3332.222222222222,2999.0,10,printed cotton round neck womens flared dress - green
aurelia,AURELIA289,AURELIA289 - Indianwear-Women,Indianwear,665.5555555555555,599.0,10,solid cotton blend womens casual tights - white
aurelia,AURELIA290,AURELIA290 - Indianwear-Women,Indianwear,2499.0,1249.0,50,printed round neck crepe womens flared dress - green
aurelia,AURELIA291,AURELIA291 - Indianwear-Women,Indianwear,2299.0,1609.0,30,yarn dyed cotton mandarin womens a line kurta - orange
aurelia,AURELIA292,AURELIA292 - Indianwear-Women,Indianwear,4299.0,2149.0,50,printed viscose blend round neck womens ethnic set - green
aurelia,AURELIA293,AURELIA293 - Indianwear-Women,Indianwear,4776.666666666667,4299.0,10,printed georgette womens flared dress - pink
aurelia,AURELIA294,AURELIA294 - Indianwear-Women,Indianwear,1999.0,1399.0,30,dyed cotton womens a line kurta - green
aurelia,AURELIA295,AURELIA295 - Indianwear-Women,Indianwear,1443.3333333333333,1299.0,10,round neck straight designer womens kurtas - blue
aurelia,AURELIA296,AURELIA296 - Indianwear-Women,Indianwear,2665.5555555555557,2399.0,10,regular fit polyester womens festive skirt - green
aurelia,AURELIA297,AURELIA297 - Indianwear-Women,Indianwear,1099.0,769.0,30,printed viscose mandarin womens straight kurta - green
aurelia,AURELIA298,AURELIA298 - Indianwear-Women,Indianwear,1999.0,1199.0,40,30's rayon womens non festive skirt - blue
aurelia,AURELIA299,AURELIA299 - Indianwear-Women,Indianwear,3799.0,1899.0,50,printed viscose round neck womens ethnic set - yellow
aurelia,AURELIA300,AURELIA300 - Indianwear-Women,Indianwear,4443.333333333333,3999.0,10,printed polyester regular fit womens kurta set - blue
aurelia,AURELIA301,AURELIA301 - Indianwear-Women,Indianwear,2799.0,1959.0,30,printed round neck viscose womens flared dress - green
aurelia,AURELIA302,AURELIA302 - Indianwear-Women,Indianwear,2299.0,1609.0,30,dyed cotton womens a line dress - green
aurelia,AURELIA303,AURELIA303 - Indianwear-Women,Indianwear,1332.2222222222222,1199.0,10,printed round neck viscose womens calf length kurta - black
aurelia,AURELIA304,AURELIA304 - Indianwear-Women,Indianwear,799.0,479.0,40,solid viscose womens regular length palazzos - pink
aurelia,AURELIA305,AURELIA305 - Indianwear-Women,Indianwear,1110.0,999.0,10,dyed regular fit viscose blend womens casual trousers - yellow
aurelia,AURELIA306,AURELIA306 - Indianwear-Women,Indianwear,1999.0,1399.0,30,v- neck polyester flared designer womens dresses - peach
aurelia,AURELIA307,AURELIA307 - Indianwear-Women,Indianwear,2887.777777777778,2599.0,10,solid polyester mandarin womens ethnic set - green
aurelia,AURELIA308,AURELIA308 - Indianwear-Women,Indianwear,1776.6666666666665,1599.0,10,printed poly viscose womens straight kurta - white
aurelia,AURELIA309,AURELIA309 - Indianwear-Women,Indianwear,1299.0,909.0,30,printed mandarin polyester womens above knee kurta - green
aurelia,AURELIA310,AURELIA310 - Indianwear-Women,Indianwear,2299.0,1149.0,50,printed polyester round neck womens ankle length kurta - green
aurelia,AURELIA311,AURELIA311 - Indianwear-Women,Indianwear,3998.8888888888887,3599.0,10,printed polyester mandarin womens ethnic set - pink
aurelia,AURELIA312,AURELIA312 - Indianwear-Women,Indianwear,2699.0,1889.0,30,yarn dyed cotton collar neck womens ethnic set - green
aurelia,AURELIA313,AURELIA313 - Indianwear-Women,Indianwear,1299.0,909.0,30,dyed cotton round neck womens straight kurta - white
aurelia,AURELIA314,AURELIA314 - Indianwear-Women,Indianwear,1699.0,849.0,50,printed mandarin neck polyester womens flared dress - blue
aurelia,AURELIA315,AURELIA315 - Indianwear-Women,Indianwear,1799.0,899.0,50,printed polyester round neck womens calf length kurta - peach
aurelia,AURELIA316,AURELIA316 - Indianwear-Women,Indianwear,799.0,479.0,40,solid regular fit cotton lycra womens casual pants - pink
aurelia,AURELIA317,AURELIA317 - Indianwear-Women,Indianwear,1165.5555555555554,1049.0,10,dyed cotton mandarin neck womens above knee kurta - blue
aurelia,AURELIA318,AURELIA318 - Indianwear-Women,Indianwear,1499.0,899.0,40,yarn dyed rayan zari womens festive culottes - navy
aurelia,AURELIA319,AURELIA319 - Indianwear-Women,Indianwear,1999.0,1399.0,30,printed georgette round neck womens flared kurta - green
aurelia,AURELIA320,AURELIA320 - Indianwear-Women,Indianwear,2299.0,1609.0,30,v- neck cotton designer womens ethnic set - peach
aurelia,AURELIA321,AURELIA321 - Indianwear-Women,Indianwear,1554.4444444444443,1399.0,10,dyed cotton round neck womens straight kurta - green
aurelia,AURELIA322,AURELIA322 - Indianwear-Women,Indianwear,1998.888888888889,1799.0,10,dyed cotton womens straight kurta - grey
aurelia,AURELIA323,AURELIA323 - Indianwear-Women,Indianwear,1110.0,999.0,10,printed polyester blend womens festive palazzo - gold
aurelia,AURELIA324,AURELIA324 - Indianwear-Women,Indianwear,1443.3333333333333,1299.0,10,solid viscose mandarin womens straight kurta - pink
aurelia,AURELIA325,AURELIA325 - Indianwear-Women,Indianwear,699.0,489.0,30,solid cotton blend womens casual tights - green
aurelia,AURELIA326,AURELIA326 - Indianwear-Women,Indianwear,3332.222222222222,2999.0,10,printed poly viscose mandarin womens flared kurta - white
aurelia,AURELIA327,AURELIA327 - Indianwear-Women,Indianwear,699.0,489.0,30,solid cotton lycra womens casual tights - blue
aurelia,AURELIA328,AURELIA328 - Indianwear-Women,Indianwear,776.6666666666666,699.0,10,printed polyester womens casual dupatta - green
aurelia,AURELIA329,AURELIA329 - Indianwear-Women,Indianwear,2776.6666666666665,2499.0,10,cotton band with placket womens kurta set - green
aurelia,AURELIA330,AURELIA330 - Indianwear-Women,Indianwear,1699.0,849.0,50,printed round neck straight womens kurta - white
aurelia,AURELIA331,AURELIA331 - Indianwear-Women,Indianwear,665.5555555555555,599.0,10,solid cotton lycra womens casual tights - yellow
aurelia,AURELIA332,AURELIA332 - Indianwear-Women,Indianwear,2999.0,1499.0,50,printed viscose collared neck womens ethnic set - black
aurelia,AURELIA333,AURELIA333 - Indianwear-Women,Indianwear,1499.0,1049.0,30,printed polyester mandarin womens straight kurta - green
aurelia,AURELIA334,AURELIA334 - Indianwear-Women,Indianwear,3999.0,2799.0,30,printed viscose regular fit womens straight ethnic set - yellow
aurelia,AURELIA335,AURELIA335 - Indianwear-Women,Indianwear,1665.5555555555554,1499.0,10,printed polyester regular fit womens festive culottes - white
aurelia,AURELIA336,AURELIA336 - Indianwear-Women,Indianwear,2887.777777777778,2599.0,10,printed polyester mandarin womens flared kurta - red
aurelia,AURELIA337,AURELIA337 - Indianwear-Women,Indianwear,3998.8888888888887,3599.0,10,printed polyester round neck womens ethnic set - pink
aurelia,AURELIA338,AURELIA338 - Indianwear-Women,Indianwear,1443.3333333333333,1299.0,10,printed viscose v- neck womens straight kurta - brown
aurelia,AURELIA339,AURELIA339 - Indianwear-Women,Indianwear,1887.7777777777778,1699.0,10,printed polyester round neck womens straight kurta - blue
aurelia,AURELIA340,AURELIA340 - Indianwear-Women,Indianwear,665.5555555555555,599.0,10,solid cotton lycra regular fit womens casual tights - blue
aurelia,AURELIA341,AURELIA341 - Indianwear-Women,Indianwear,1332.2222222222222,1199.0,10,printed round neck cotton womens knee length kurta - yellow
aurelia,AURELIA342,AURELIA342 - Indianwear-Women,Indianwear,2998.8888888888887,2699.0,10,dyed cotton womens ethnic set - peach
aurelia,AURELIA343,AURELIA343 - Indianwear-Women,Indianwear,1299.0,649.0,50,printed band with v straight womens kurta - blue
aurelia,AURELIA344,AURELIA344 - Indianwear-Women,Indianwear,1599.0,1119.0,30,collar neck polyester straight designer womens dresses - green
aurelia,AURELIA345,AURELIA345 - Indianwear-Women,Indianwear,2998.8888888888887,2699.0,10,printed viscose round neck womens ethnic set - blue
aurelia,AURELIA346,AURELIA346 - Indianwear-Women,Indianwear,1221.111111111111,1099.0,10,solid polyester mandarin womens straight kurta - green
aurelia,AURELIA347,AURELIA347 - Indianwear-Women,Indianwear,1110.0,999.0,10,printed polyester regular fit womens dupatta - green
aurelia,AURELIA348,AURELIA348 - Indianwear-Women,Indianwear,1399.0,979.0,30,printed viscose womens straight kurta - orange
aurelia,AURELIA349,AURELIA349 - Indianwear-Women,Indianwear,2221.111111111111,1999.0,10,printed viscose round neck womens ethnic set - black
aurelia,AURELIA350,AURELIA350 - Indianwear-Women,Indianwear,3332.222222222222,2999.0,10,printed viscose round neck womens ethnic set - green
aurelia,AURELIA351,AURELIA351 - Indianwear-Women,Indianwear,1199.0,839.0,30,printed round neck cotton womens knee length kurta - yellow
aurelia,AURELIA352,AURELIA352 - Indianwear-Women,Indianwear,887.7777777777777,799.0,10,printed round neck straight womens kurta - deep blue
aurelia,AURELIA353,AURELIA353 - Indianwear-Women,Indianwear,1499.0,1049.0,30,yarn dyed viscose v neck womens straight kurta - green
aurelia,AURELIA354,AURELIA354 - Indianwear-Women,Indianwear,3332.222222222222,2999.0,10,printed viscose round neck womens flared dress - red
aurelia,AURELIA355,AURELIA355 - Indianwear-Women,Indianwear,1199.0,719.0,40,solid regular fit cotton flex womens casual trousers - white
aurelia,AURELIA356,AURELIA356 - Indianwear-Women,Indianwear,1299.0,779.0,40,printed regular fit viscose womens casual culottes - multi
aurelia,AURELIA357,AURELIA357 - Indianwear-Women,Indianwear,4999.0,2499.0,50,printed viscose blend round neck womens ethnic set - red
aurelia,AURELIA358,AURELIA358 - Indianwear-Women,Indianwear,2665.5555555555557,2399.0,10,regular fit polyester womens festive skirt - blue
aurelia,AURELIA359,AURELIA359 - Indianwear-Women,Indianwear,1165.5555555555554,1049.0,10,round neck rayon womens below knee kurta - natural
aurelia,AURELIA360,AURELIA360 - Indianwear-Women,Indianwear,2776.6666666666665,2499.0,10,cotton band with placket womens kurta set - natural
aurelia,AURELIA361,AURELIA361 - Indianwear-Women,Indianwear,1554.4444444444443,1399.0,10,yarn dyed cotton round neck womens straight kurta - white
aurelia,AURELIA362,AURELIA362 - Indianwear-Women,Indianwear,1399.0,699.0,50,solid viscose mandarin neck womens above knee kurta - black
aurelia,AURELIA363,AURELIA363 - Indianwear-Women,Indianwear,1999.0,1399.0,30,dyed collared neck viscose womens straight fit dress - olive
aurelia,AURELIA364,AURELIA364 - Indianwear-Women,Indianwear,1799.0,899.0,50,printed viscose round neck womens straight kurta - yellow
aurelia,AURELIA365,AURELIA365 - Indianwear-Women,Indianwear,2887.777777777778,2599.0,10,solid cotton womens ethnic set - navy
aurelia,AURELIA366,AURELIA366 - Indianwear-Women,Indianwear,3110.0,2799.0,10,printed polyester round neck womens flared kurta - yellow
aurelia,AURELIA367,AURELIA367 - Indianwear-Women,Indianwear,3799.0,2659.0,30,printed poly viscose womens ethnic set - blue
aurelia,AURELIA368,AURELIA368 - Indianwear-Women,Indianwear,1199.0,599.0,50,printed polyester round neck womens straight kurta - blue
aurelia,AURELIA369,AURELIA369 - Indianwear-Women,Indianwear,3999.0,2799.0,30,printed viscose round neck womens ethnic set - green
aurelia,AURELIA370,AURELIA370 - Indianwear-Women,Indianwear,1199.0,839.0,30,round neck straight designer womens kurtas - orange
aurelia,AURELIA371,AURELIA371 - Indianwear-Women,Indianwear,1999.0,1399.0,30,dyed cotton womens ethnic set - yellow
aurelia,AURELIA372,AURELIA372 - Indianwear-Women,Indianwear,3332.222222222222,2999.0,10,printed cotton round neck womens flared dress - blue
aurelia,AURELIA373,AURELIA373 - Indianwear-Women,Indianwear,4443.333333333333,3999.0,10,printed rayon blend regular fit womens straight ethnic set - blue
aurelia,AURELIA374,AURELIA374 - Indianwear-Women,Indianwear,1799.0,1259.0,30,band with placket cotton womens calf length kurta - red
aurelia,AURELIA375,AURELIA375 - Indianwear-Women,Indianwear,4299.0,2149.0,50,printed polyester round neck womens ethnic set - blue
aurelia,AURELIA376,AURELIA376 - Indianwear-Women,Indianwear,1199.0,599.0,50,solid viscose blend round neck womens above knee kurta - red
aurelia,AURELIA377,AURELIA377 - Indianwear-Women,Indianwear,3332.222222222222,2999.0,10,printed cotton round neck womens flared dress - pink
aurelia,AURELIA378,AURELIA378 - Indianwear-Women,Indianwear,1554.4444444444443,1399.0,10,printed viscose womens straight kurta - green
aurelia,AURELIA379,AURELIA379 - Indianwear-Women,Indianwear,1776.6666666666665,1599.0,10,mandarin straight designer womens kurtas - mustard
aurelia,AURELIA380,AURELIA380 - Indianwear-Women,Indianwear,1776.6666666666665,1599.0,10,printed viscose round neck womens straight kurta - peach
aurelia,AURELIA381,AURELIA381 - Indianwear-Women,Indianwear,1499.0,1049.0,30,printed viscose womens festive culottes - peach
aurelia,AURELIA382,AURELIA382 - Indianwear-Women,Indianwear,1998.888888888889,1799.0,10,dyed cotton round neck womens ethnic set - pink
aurelia,AURELIA383,AURELIA383 - Indianwear-Women,Indianwear,1665.5555555555554,1499.0,10,printed polyester regular fit womens festive culottes - pink
aurelia,AURELIA384,AURELIA384 - Indianwear-Women,Indianwear,3999.0,1999.0,50,dyed viscose round neck womens ethnic set - pink
aurelia,AURELIA385,AURELIA385 - Indianwear-Women,Indianwear,1599.0,1119.0,30,printed v-neck cotton womens knee length kurta - brown
aurelia,AURELIA386,AURELIA386 - Indianwear-Women,Indianwear,2221.111111111111,1999.0,10,printed georgette regular fit womens casual culottes - yellow
aurelia,AURELIA387,AURELIA387 - Indianwear-Women,Indianwear,1554.4444444444443,1399.0,10,round neck straight designer womens kurtas - black
aurelia,AURELIA388,AURELIA388 - Indianwear-Women,Indianwear,2499.0,1749.0,30,printed viscose round neck womens kurta set - green
aurelia,AURELIA389,AURELIA389 - Indianwear-Women,Indianwear,1554.4444444444443,1399.0,10,printed viscose mandarin womens straight kurta - blue
aurelia,AURELIA390,AURELIA390 - Indianwear-Women,Indianwear,665.5555555555555,599.0,10,solid cotton lycra womens casual tights - purple
aurelia,AURELIA391,AURELIA391 - Indianwear-Women,Indianwear,3998.8888888888887,3599.0,10,printed polyester regular fit womens kurti set - red
aurelia,AURELIA392,AURELIA392 - Indianwear-Women,Indianwear,1443.3333333333333,1299.0,10,printed viscose blend round neck womens knee length kurta - green
aurelia,AURELIA393,AURELIA393 - Indianwear-Women,Indianwear,2221.111111111111,1999.0,10,printed polyester round neck womens calf length kurta - blue
aurelia,AURELIA394,AURELIA394 - Indianwear-Women,Indianwear,1399.0,699.0,50,printed viscose round neck womens above knee kurta - red
aurelia,AURELIA395,AURELIA395 - Indianwear-Women,Indianwear,3999.0,1999.0,50,dyed polyester round neck womens ethnic set - white
aurelia,AURELIA396,AURELIA396 - Indianwear-Women,Indianwear,1199.0,599.0,50,dyed viscose round neck womens above knee kurta - white
aurelia,AURELIA397,AURELIA397 - Indianwear-Women,Indianwear,2299.0,1379.0,40,regular fit regular length womens festive wear skirt - white
aurelia,AURELIA398,AURELIA398 - Indianwear-Women,Indianwear,665.5555555555555,599.0,10,solid cotton blend womens casual tights - green
aurelia,AURELIA399,AURELIA399 - Indianwear-Women,Indianwear,1049.0,734.0,30,solid viscose regular fit womens casual culottes - yellow
aurelia,AURELIA400,AURELIA400 - Indianwear-Women,Indianwear,1665.5555555555554,1499.0,10,printed polyester regular fit womens casual culottes - blue
aurelia,AURELIA401,AURELIA401 - Indianwear-Women,Indianwear,2599.0,1819.0,30,printed viscose mandarin womens flared dress - peach
aurelia,AURELIA402,AURELIA402 - Indianwear-Women,Indianwear,1776.6666666666665,1599.0,10,dyed cotton womens straight kurta - orange
aurelia,AURELIA403,AURELIA403 - Indianwear-Women,Indianwear,2799.0,1959.0,30,dyed cotton round neck womens ethnic set - white
aurelia,AURELIA404,AURELIA404 - Indianwear-Women,Indianwear,887.7777777777777,799.0,10,dyed cotton womens casual dupatta - yellow
aurelia,AURELIA405,AURELIA405 - Indianwear-Women,Indianwear,887.7777777777777,799.0,10,printed man made fibre womens casual dupatta - navy
aurelia,AURELIA406,AURELIA406 - Indianwear-Women,Indianwear,1299.0,649.0,50,printed viscose round neck womens above knee kurta - grey
aurelia,AURELIA407,AURELIA407 - Indianwear-Women,Indianwear,1776.6666666666665,1599.0,10,mandarin straight designer womens kurtas - blue
aurelia,AURELIA408,AURELIA408 - Indianwear-Women,Indianwear,699.0,419.0,40,printed cotton mandarin neck womens knee length kurta - yellow
aurelia,AURELIA409,AURELIA409 - Indianwear-Women,Indianwear,2221.111111111111,1999.0,10,dyed cotton round neck womens ethnic set - white
aurelia,AURELIA410,AURELIA410 - Indianwear-Women,Indianwear,1443.3333333333333,1299.0,10,printed viscose round neck womens straight kurta - yellow
aurelia,AURELIA411,AURELIA411 - Indianwear-Women,Indianwear,1665.5555555555554,1499.0,10,printed viscose round neck womens straight kurta - green
aurelia,AURELIA412,AURELIA412 - Indianwear-Women,Indianwear,1776.6666666666665,1599.0,10,printed viscose round neck womens calf length kurta - green
aurelia,AURELIA413,AURELIA413 - Indianwear-Women,Indianwear,554.4444444444445,499.0,10,dyed cotton regular fit womens casual dupatta - blue
aurelia,AURELIA414,AURELIA414 - Indianwear-Women,Indianwear,999.0,699.0,30,v- neck straight designer womens kurtas - blue
aurelia,AURELIA415,AURELIA415 - Indianwear-Women,Indianwear,1554.4444444444443,1399.0,10,round neck straight designer womens kurtas - navy
aurelia,AURELIA416,AURELIA416 - Indianwear-Women,Indianwear,1776.6666666666665,1599.0,10,dyed rayon collared neck womens above knee kurta - green
aurelia,AURELIA417,AURELIA417 - Indianwear-Women,Indianwear,1199.0,839.0,30,printed cotton u neck womens straight kurta - blue
aurelia,AURELIA418,AURELIA418 - Indianwear-Women,Indianwear,887.7777777777777,799.0,10,cotton womens casual dupatta - green
aurelia,AURELIA419,AURELIA419 - Indianwear-Women,Indianwear,665.5555555555555,599.0,10,solid cotton blend womens casual tights - black
